employerId,employerName,employerProfileId,employerProfileName,jobTitle,locationName,minimumSalary,maximumSalary,currency,expirationDate,date,jobDescription,applications,jobUrl,id
575264,Reed,None,None,Workshop Assistant,AB210BH,15.0,16.0,GBP,23/04/2024,20/03/2024,"REED Engineering are seeking a Workshop Assistant to join their client in the Dyce area on an ongoing temporary basis. This will be a full-time, workshop-based position. Responsibilities: Assisting in the maintenance of downhole tooling including redressing, repairing and modifying of equipment Upkeep of company records Operation of forklift Maintain stock records accuracy To be suited to this role, we are looking for: Workshop experience within...",7,https://www.reed.co.uk/jobs/workshop-assistant/52348631,52348631
672884,KCA Deutag Drilling Limited,None,None,Enterprise Resource Planning,AB124XX,None,None,None,10/05/2024,15/02/2024,"KCA Deutag encourage all qualified applicants to apply and will not discriminate on the basis of disability, race, gender identity, religion, and more. We value all our people and their contributions and recognise the benefits we gain from the diversity that exists amongst our teams. Who We Are Looking For: Enterprise Resource Planning (ERP) Project Manager Location: Aberdeen Head Office (50/50 Hybrid working) Work Schedule: 37.5 hours per week ...",28,https://www.reed.co.uk/jobs/enterprise-resource-planning/52141633,52141633
393949,Flow Recruitment,None,None,Senior Sous Chef - Luxury Golf and Hotel Resort,AB238YE,40000.0,45000.0,GBP,23/04/2024,11/03/2024,Our client is a world renowed Luxury Hotel operator. They are currently looking to recruit an Sous Chef Chef for their leading Golf and Hotel operation based in Aberdeenshire. Role Job Description: The Senior Sous Chef supports the Executive Head Chef on the delivery of 5-star dining and food services at The Clubhouse and Hotel. This is a hands-on cooking and management role. This is a hands-on cooking and management role. High-quality informal ...,4,https://www.reed.co.uk/jobs/senior-sous-chef-luxury-golf-and-hotel-resort/52291989,52291989
393949,Flow Recruitment,None,None,Head Chef - Exclusive Golf and Hotel Resort,AB238YE,50000.0,60000.0,GBP,23/04/2024,11/03/2024,"Our client is a world renowned Luxury Hotel operator. They are currently looking to recruit an Head Chef for their leading operation based in Aberdeenshire. The Position: Under the direction of the Executive Head Chef and Head of Operations, the Head Chef has responsibility for delivering five-star cooking and dining experiences across the estate facilities. As a senior member of the culinary team, this role requires a high level of organisation...",4,https://www.reed.co.uk/jobs/head-chef-exclusive-golf-and-hotel-resort/52291987,52291987
575264,Reed,None,None,Senior Finance Assistant,AB123WD,30000.0,34000.0,GBP,28/04/2024,27/03/2024,"Reed Accountancy is delighted to be working with a returning client within the bustling city centre of Aberdeen. My client is looking for a Senior Finance Assistant to join their growing business and team. This role&nbsp;has been created, due to the growth&nbsp;of their organisation.&nbsp; The role: Hours – full-time &amp; permanent (9am – 5pm with a 1-hour lunch)&nbsp; Location – Aberdeen city centre Office – Fully office based Salary - From 30...",6,https://www.reed.co.uk/jobs/senior-finance-assistant/52385577,52385577
575264,Reed,None,None,Storesperson / Driver,AB123LF,25000.0,28000.0,GBP,06/05/2024,28/03/2024,"REED Engineering are supporting their Oil &amp; Gas service company who manufacture and supply good for the industry in sourcing for them a full-time Storesperson / Driver. Based in the Altens area, this position represents a good opportunity for a candidate to join a company who are in the midst of expansion. Day-to-day you will be: Receiving and storing of incoming deliveries Operation of forklift (Training provided if necessary) Delivery of o...",11,https://www.reed.co.uk/jobs/storesperson-driver/52394609,52394609
575264,Reed,None,None,Technical Sales Engineer,AB123LF,23000.0,28000.0,GBP,23/04/2024,08/03/2024,"Interested in taking your first steps into the Engineering industry? Then read on. REED Engineering are once again partnering with a cutting-edge Engineering company who are looking to add another Graduate Sales Engineer to their team on a permanent basis. This role represents an opportunity to work alongside an innovative team who are taking a patented, unique piece of technology to market. You will be rewarded with a good entry-level salary wi...",7,https://www.reed.co.uk/jobs/technical-sales-engineer/52278754,52278754
632253,Simon Acres Recruitment,None,None,KBB Sales Designer,AB238JW,23000.0,24000.0,GBP,30/05/2024,17/04/2024,"Our client is looking to recruit a dynamic person to fulfil the role of KBB Sales Designer in Aberdeenshire. This is an excellent opportunity to join a passionate dynamic team, the successful applicant will work with a well-known company that has an industry-leading range of products to offer their customers. As a KBB Sales Designer the individual will be proactive and take ownership of selling and project managing every part of the process, ens...",0,https://www.reed.co.uk/jobs/kbb-sales-designer/52489167,52489167
636848,Techniche Global Ltd,None,None,"Control Systems Engineer Perm, Aberdeen",AB228GT,40000.0,55000.0,GBP,27/04/2024,28/03/2024,"Techniche are supporting a leading automation organisation, assisting them with hiring a new Control System Engineer out of their Aberdeen office. The copmany is open to hiring an experienced engineer as well as a more junior/entry level engineer. &nbsp; The company specialize in Oil &amp; Gas production, transportation and processing with a team of over a 1,000 experts serving customers globally. &nbsp; This role is focused on providing support...",6,https://www.reed.co.uk/jobs/control-systems-engineer-perm-aberdeen/52395180,52395180
548569,The Recruitment Solution (London) Ltd,None,None,Smart Repair Technician,AB123LE,30000.0,35000.0,GBP,25/04/2024,13/03/2024,"Smart Repair Technicians, Do you want to earn a fabulous salary plus a bonus? Working for a world recognised brand that offers on going excellent training and development and a 2000 JOINING BONUS! The Recruitment Solution are looking to recruit an experienced SMART Repair Technician for this award-winning brand, main dealer Bodyshop based in Aberdeen. Requirements for this SMART Repairer role • You will need to have experience of completing work...",2,https://www.reed.co.uk/jobs/smart-repair-technician/52310597,52310597
537530,Superbike Factory Ltd,None,None,MOTORCYCLE TECHNICIAN (ALL LEVELS),United Kingdom,25000.0,35000.0,GBP,01/06/2024,19/04/2024,"A Day in the Life of our Technicians: No two days are the same in our workshop; with exposure to all makes and models, the technical knowledge you can gain with us is a rare opportunity within the industry. From day to day, you would be working on the latest motorcycles available on the market; something a single main dealership cannot offer. Our technicians cover all level of mechanics including: Diagnosing standard and complex faults and ensur...",1,https://www.reed.co.uk/jobs/motorcycle-technician-all-levels/52505486,52505486
599611,Verisure,None,None,Sales Executive,United Kingdom,25000.0,35000.0,GBP,28/05/2024,15/04/2024,"The Sales role comes with a combination of a guaranteed salary and an uncapped commission scheme. Typically, Sales Assistants earn between 30k - 40k OTE in their first year, and our top performers can earn more than 60k OTE. This Sales role offers the following: Company car with fuel card and mobile phone (subject to terms). The chance to boost your salary with an uncapped commission scheme . A solid career path with excellent growth opportuniti...",79,https://www.reed.co.uk/jobs/sales-executive/52474498,52474498
441588,Lidl GB,None,None,Warehouse Operative,United Kingdom,12.0,13.85,GBP,31/05/2024,18/04/2024,"Summary - Inside M25 = 13.55- 13.85 - Outside M25 = 12- 13 . This isn’t 9-5. This is making the most of every day. Shift patterns: Various shifts available Our warehouses never stop running; 24 hours a day, our Warehouse Operatives work a range of shifts to make sure our stores receive the right stock, when they need it. We rely on every single employee in the warehouse to roll up their sleeves and get the job done - it’s your energy that helps ...",550,https://www.reed.co.uk/jobs/warehouse-operative/52497935,52497935
441588,Lidl GB,None,None,Deputy Store Manager,United Kingdom,34.0,42.0,GBP,31/05/2024,18/04/2024,"Summary 34,000 up to 42,000 per annum (pro rata) This isn’t only being hands-on. This is being switched on. Our Deputy Store Managers keep our stores running like clockwork, working on the shop floor with a driven team of Customer Assistants, Specialists and Shift Managers. We rely on our Deputy Store Managers to ensure the team is working efficiently to complete tasks accurately and on time. You’ll be given great responsibility, ensuring the te...",26,https://www.reed.co.uk/jobs/deputy-store-manager/52497926,52497926
441588,Lidl GB,None,None,Retail Shift Manager,United Kingdom,14.0,15.35,GBP,31/05/2024,18/04/2024,"Summary Inside M25 = 14.85- 15.35 - Outside M25 14.00- 14.50 - This isn’t clocking in and clocking out. This is helping us run like clockwork. Internally this role will be called Shift Manager Our Shift Managers keep our stores running like clockwork. From motivating the team and delegating tasks, to rolling up their sleeves and getting stuck in, our Shift Managers help us to maintain our high standards every day. They support our Store Managers...",48,https://www.reed.co.uk/jobs/retail-shift-manager/52497809,52497809
441588,Lidl GB,None,None,Customer Assistant,United Kingdom,12.0,13.85,GBP,31/05/2024,18/04/2024,"Inside M25 = 13.55- 13.85 - Outside M25 = 12- 13 - This isn’t stacking shelves. This is feeding families. As a Customer Assistant at Lidl, no shift is the same and you get out what you put in. Starting at 5am some days to set up the store bakery for the day or finishing at 11pm on others to close the store and ensure the store is ready for another day of customers, you’ll keep moving and keep business booming. Every day is different, so you won’...",100,https://www.reed.co.uk/jobs/customer-assistant/52497790,52497790
674687,Williams International Real Estate,None,None,Real Estate Consultant,United Kingdom,None,None,None,23/05/2024,10/04/2024,"Dreaming of a career in Dubai real estate? Want to live in one of the most exciting places in the world and take advantage of tax free &amp; uncapped earning potential? Williams International Real Estate has been formed with the prime goal of giving an honest, informative and professional service to our clients, as well as giving brokers and everyone else under the WIRE umbrella a platform for real success in a positive and fair working environm...",90,https://www.reed.co.uk/jobs/real-estate-consultant/52449015,52449015
645429,Prestige Luxury Real Estate,None,None,Sales Executive - Relocate to Dubai,United Kingdom,30000.0,200000.0,GBP,30/05/2024,17/04/2024,"**Sales Executive - Relocate to Dubai** Why Work in Dubai Real Estate? Are you a seasoned sales champion looking for a fresh challenge? Or maybe you’re just stepping into sales, armed with a charismatic personality and readiness to start working in the Dubai real estate market? No matter your story or where you're coming from, we're opening doors for you to rake in limitless, tax-free earnings as you carve out your niche in international real es...",25,https://www.reed.co.uk/jobs/sales-executive-relocate-to-dubai/52492679,52492679
599611,Verisure,None,None,Sales,United Kingdom,25000.0,35000.0,GBP,22/05/2024,09/04/2024,"The Sales role comes with a combination of a guaranteed salary and an uncapped commission scheme. Typically, Sales Assistants earn between&nbsp; 30k&nbsp; –&nbsp; 40k &nbsp;OTE in their first year, and our top performers can earn more than&nbsp; 60k&nbsp; OTE. This Sales role offers the following: Company car &nbsp;with fuel card and&nbsp; mobile phone &nbsp;(subject to terms). The chance to boost your salary with an&nbsp; uncapped commission sc...",117,https://www.reed.co.uk/jobs/sales/52440917,52440917
675153,DLUHC Digital,None,None,Virtual Recruitment Event - Senior Developer,United Kingdom,None,None,None,25/04/2024,12/04/2024,"Fixed term Contract: 23 month contract Job Description Come along and meet us at our virtual recruitment event 26th April. It’s a great chance to connect, meet and potentially get hired. Here at the Department for Levelling Up, Housing and Communities (DLUHC), we work on things that make a real difference to people’s lives. Find out more about what it's like to work in a digital, data and technology role at DLUHC including our culture, ways of w...",56,https://www.reed.co.uk/jobs/virtual-recruitment-event-senior-developer/52466860,52466860
645429,Prestige Luxury Real Estate,None,None,Estate Agent - Relocate to Dubai,United Kingdom,30000.0,200000.0,GBP,08/05/2024,26/03/2024,"**Estate Agent - Relocate to Dubai** Why Work in Dubai Real Estate? Are you a seasoned sales champion looking for a fresh challenge? Or maybe you’re just stepping into sales, armed with a charismatic personality and readiness to start working in the Dubai real estate market? No matter your story or where you're coming from, we're opening doors for you to rake in limitless, tax-free earnings as you carve out your niche in international real estat...",108,https://www.reed.co.uk/jobs/estate-agent-relocate-to-dubai/52380374,52380374
456295,Hillarys Blinds,None,None,Blinds & Curtains Fitter,United Kingdom,25000.0,50000.0,GBP,01/05/2024,19/03/2024,"Blinds &amp; Curtains Fitter 25,000 - 50,000 APPLY NOW AND JOIN US FOR A VIRTUAL 1 HOUR DISCOVERY SESSION. Take the first step to discover why over 1200 people successfully run a Hillarys advisor business, locally. Would you like an additional income or are you looking for a change in career? Our Advisors enjoy high earnings, alongside flexible working that works with their lifestyle. Most have no experience selling and/or installing blinds, cur...",122,https://www.reed.co.uk/jobs/blinds-curtains-fitter/52342678,52342678
421408,Unite Students,None,None,Claims Quantity Surveyor,United Kingdom,None,None,None,26/04/2024,14/03/2024,"Unite Students` Projects Team have an opportunity for an experienced Claims Quantity Surveyor to join the team. Reporting to the Commercial Manager, the Claims QS will provide commercial input into all live and prospective cladding claims relating to facade remedial andreplacement projects undertaken by the Estates Project Team. Duties will include commercial andclaims management, managing the flow of information in support of claims, reporting ...",51,https://www.reed.co.uk/jobs/claims-quantity-surveyor/52315988,52315988
452194,Allsopp & Allsopp,None,None,Sales Consultant,United Kingdom,30000.0,120000.0,GBP,25/04/2024,13/03/2024,"Sales Consultant Are you a sales achiever wanting the next step, or perhaps you are new to sales but think you have a killer personality and want to flex your muscles selling and letting properties in the Dubai real estate market? Whoever you are and whatever your background, we have an opportunity for you to earn unlimited tax-free money developing a career in international real estate with the real estate agency that consistently receives the ...",431,https://www.reed.co.uk/jobs/sales-consultant/52302086,52302086
548569,The Recruitment Solution (London) Ltd,None,None,Vehicle Technician,AB123LE,40000.0,45000.0,GBP,31/05/2024,18/04/2024,"Vehicle Technicians, Would you like 25 days holiday a year PLUS Bank Holidays? Enjoy a fantastic Basic salary, bonus, and benefits package? Receive ongoing training and regular salary increases? Would you also like a 2000 joining bonus? Working on behalf of one of our valued clients based in the Aberdeen area,The Recruitment Solution have an opening for an experienced Technician/Mechanic. This is a fantastic opportunity, you will get the chance ...",0,https://www.reed.co.uk/jobs/vehicle-technician/52501720,52501720
636848,Techniche Global Ltd,None,None,Control Systems Engineer,AB228GT,45.0,55.0,GBP,27/04/2024,28/03/2024,"We are working with a leading automation organization that specializes in oil &amp; gas production, transportation, and processing. We are supporting them in appointing a number of experienced Control Systems Engineering Contractors for their office in Aberdeen. &nbsp; This role is primarily focused on site-based activities, with an equal 50/50 split between site and office work. A significant portion of the site-based work will be offshore. Whi...",1,https://www.reed.co.uk/jobs/control-systems-engineer/52395473,52395473
620024,Pertemps Scotland,None,None,CNC Machinist,AB238GW,None,None,None,25/04/2024,27/03/2024,"Job Title: CNC Machinist Location: Aberdeen Salary: Up to 17.50 per hour DOE Working hours: Flexible working hours between Monday to Friday 6am - 6pm and Friday 6am - 2pm Reports To: Machine Shop Team Leader We are delighted to be working with a fantastic company who manufacture bespoke subsea cable and connector assembly engineering for the oil and gas, marine renewable energy and defence industries. They are certified to ISO 9001 and 14001:201...",3,https://www.reed.co.uk/jobs/cnc-machinist/52385573,52385573
445437,Venture Recruitment LTD,None,None,Kitchen Designer,AB238AA,25000.0,30000.0,GBP,23/04/2024,17/04/2024,"Kitchen Design Consultant Aberdeen Up to 30,000 OTE 45,000 Well Established 40 year old kitchen design and manufacturing business with exciting growth plan. Kitchen Designers required for brand new head office kitchen design department Already a successful kitchen designer, looking to break into trade as well as work in a retail showroom? Read on…. About Us Hugely successful, award winning, well established kitchen manufacturer &amp; retail show...",0,https://www.reed.co.uk/jobs/kitchen-designer/52493767,52493767
626103,CRP Group,None,None,Workshop Assistant,AB210GU,25000.0,27500.0,GBP,31/05/2024,18/04/2024,"CRP Group are currently working alongside industry leaders in providing top-notch drain care, emergency plumbing services, and hydraulic solutions across the UK. We are seeking an experienced workshop assistant , open to individuals from any sector, to play a pivotal role in their customer service and operational efficiency. This role is ideal for self-motivated, resilient individuals with a knack for scheduling, customer service, and a willingn...",1,https://www.reed.co.uk/jobs/workshop-assistant/52496698,52496698
575264,Reed,None,None,Customer Service Engineer,AB210GP,36000.0,40000.0,GBP,13/05/2024,12/04/2024,"REED Engineering are once again supporting their Oil &amp; Gas service client who are looking to add a Customer Service Engineer to their team on a full-time, permanent basis. You will be working as part of a team who work together to support the subsea industry. This business is experiencing a huge 2024. With this expected to continue, it is an exciting time to come on board. Day-to-day duties will include: Dealing with inbound customer queries...",4,https://www.reed.co.uk/jobs/customer-service-engineer/52465079,52465079
575264,Reed,None,None,CNC Machinist,AB124YB,18.0,23.0,GBP,04/05/2024,11/01/2024,"Reed Engineering are working alongside our client who service the Oil and Gas industry who are looking to add a CNC Machinist (Turner) to their team on a permanent basis. You will be based in the South of Aberdeen. Hours: Monday – Thursday 7am – 3pm, Friday 7am – 1pm Salary: 18 – 23p/hour Daily Duties – Programme, set, and operate CNC Machine to the required standard adhering to engineering drawings and specifications Work with materials includi...",6,https://www.reed.co.uk/jobs/cnc-machinist/51935569,51935569
628817,DPD,None,None,3.5 Tonne Driver (Self-Employed),AB124ZD,50000.0,60000.0,GBP,04/05/2024,05/04/2024,"3.5 Tonne Driver (Self-Employed) - Aberdeen - Full-time - Vacancy Type: Self-Employed Driver - Working Pattern: Days - Weekend Working Included Company Description DPD is a member of DPDgroup, one of Europe's leading parcel delivery networks, and aims to be the most sustainable delivery company in the UK, with a turnover of over 2 billion. We also deliver the best service, use the best technology and recruit and retain the best people in the ind...",2,https://www.reed.co.uk/jobs/35-tonne-driver-self-employed/52428490,52428490
575264,Reed,None,None,QC Inspector - Fibre Optic,AB210GP,None,None,None,06/05/2024,05/04/2024,"REED Engineering are working exclusively with an Oil &amp; Gas service company who are looking to add a QC Inspector to their team on a full-time permanent basis. Based in the Dyce area of Aberdeen, this vacancy represents a great opportunity for either a QC Inspector looking to enhance their career, or a Technician looking to move into an inspection focused role. As QC Inspector, you will be working as part of a team to inspect finished product...",4,https://www.reed.co.uk/jobs/qc-inspector-fibre-optic/52428541,52428541
549223,Taylor Hawkes Ltd,None,None,Finance Lead,AB123GW,40000.0,60000.0,GBP,17/05/2024,04/04/2024,"Responsible for all aspects of the Company’s accounts including VAT returns, month end accounts, financial analysis, POs’ credit control, utilities Reconcile bank statements and petty cash account and ensure adequate cash flow for bank transactions Control Fixed Asset Register and process depreciation journals Reporting: o Provision of Management Accounts within agreed deadlines highlighting any areas of concern - margins, overheads etc. o Sales...",7,https://www.reed.co.uk/jobs/finance-lead/52421404,52421404
620024,Pertemps Scotland,None,None,Mechanical Hydraulic Fitter,AB123RJ,None,None,None,30/04/2024,01/04/2024,"Job Title: Mechanical Hydraulic Fitter Location: Aberdeen Salary: 30,000 - 34,000 Reports To: Workshop Manager Supervises: Fitters Assistant / Apprentice Skills Ability to read and interpret engineering drawings. Good hand skills in an engineering workshop. Good knowledge of general engineering practices such as measuring/ marking off/ manual drilling / tapping / fabrication set up and tacking. Understanding of hydraulics with ability to assembl...",2,https://www.reed.co.uk/jobs/mechanical-hydraulic-fitter/52401635,52401635
575264,Reed,None,None,QC Inspector - Electrical,AB210GP,None,None,None,06/05/2024,05/04/2024,"REED Engineering are working exclusively with an Oil &amp; Gas service company who are looking to add a QC Inspector to their team on a full-time permanent basis. Based in the Dyce area of Aberdeen, this vacancy represents a great opportunity for either a QC Inspector looking to enhance their career, or a Technician looking to move into an inspection focused role. As QC Inspector, you will be working as part of a team to inspect finished product...",3,https://www.reed.co.uk/jobs/qc-inspector-electrical/52428543,52428543
575264,Reed,None,None,QC Inspector - Electronic,AB210GP,None,None,None,06/05/2024,05/04/2024,"REED Engineering are working exclusively with an Oil &amp; Gas service company who are looking to add a QC Inspector to their team on a full-time permanent basis. Based in the Dyce area of Aberdeen, this vacancy represents a great opportunity for either a QC Inspector looking to enhance their career, or a Technician looking to move into an inspection focused role. As QC Inspector, you will be working as part of a team to inspect finished product...",3,https://www.reed.co.uk/jobs/qc-inspector-electronic/52428532,52428532
575264,Reed,None,None,CNC Machinist,AB210GS,18.34,18.34,GBP,05/05/2024,20/03/2024,"Reed Engineering are working alongside our client who is looking to add a CNC Machinist to their team on a permanent basis. You’ll be based in the Dyce area of Aberdeen. Hours: Dayshift: Monday – Thursday (8 hours), Friday (7 hours) Nightshift: Monday – Wednesday (10 hours), Thursday (9 hours) Hourly Pay Rate : 18.34 and nightshift allowance Daily Duties – Perform tasks in accordance with Job Initiation Pack and approved drawings Conduct pre-use...",4,https://www.reed.co.uk/jobs/cnc-machinist/52351298,52351298
620024,Pertemps Scotland,None,None,CNC Turner/ Miller,AB123RJ,None,None,None,30/04/2024,01/04/2024,"Job Title: CNC Turner/Miller (must be able to program and set up machines) Salary: Competitive numeration package, depending on experience Hours: Full Time 39hr week Benefits: Life insurance, pension and healthcare benefits will be offered to successful candidates Location: South Aberdeen Located in Tullos on the south side of Aberdeen, close to the new WPR, a position exists for an experienced CNC Turner/Miller. There is also an opportunity for...",0,https://www.reed.co.uk/jobs/cnc-turner-miller/52401630,52401630
620024,Pertemps Scotland,None,None,Design Draftsperson,AB123RJ,None,None,None,30/04/2024,01/04/2024,"Job Title: Design Draftsperson Salary: Negotiable depending on experience Benefits: Company pension, Life insurance cover and a Healthshield plan. Hours: Full-time, Monday to Friday, hours 08:00 - 5:30 (40.25 hr week) Location: South Aberdeen Our client is a successful and well-established engineering firm and leading specialist in the design and manufacture of hydraulic engineering solutions.&nbsp;The company is looking to recruit a skilled and...",3,https://www.reed.co.uk/jobs/design-draftsperson/52401626,52401626
