employerId,employerName,employerProfileId,employerProfileName,jobTitle,locationName,minimumSalary,maximumSalary,currency,expirationDate,date,jobDescription,applications,jobUrl,id
274539,Heat Recruitment,,,Trainee Financial Adviser,CO33HH,25000.0,35000.0,GBP,07/05/2024,08/01/2024,"A reputable, established IFA in Colcester is seeking a Trainee Adviser to join their thriving team. The company has experienced steady growth over the past few years and has achieved this through developing strong relationships and their balance of professionalism and friendliness has a big part to play in their success. This firm has created a culture where the business remains client focused and encourages everyone to achieve their goals. This... ",17,https://www.reed.co.uk/jobs/trainee-financial-adviser/51907409,51907409
391063,Opus Recruitment Solutions Ltd,,,Network Infrastructure Engineer,London,55000.0,70000.0,GBP,08/05/2024,26/03/2024,"Network Infrastructure Engineer Cisco, Palo Alto, Azure, F5, CheckPoint London – Hybrid 55,0000 - 70,000 Plus 12% Pension, Private Healthcare and much more!&nbsp; I am partnered with the 1 of the UK’s leading financial institutions – responsible for resolving for 1000s of financial disputes for small businesses, consumers and the general public! They are seeking to expand their Network Infrastructure Team and looking for passionate IT technologi... ",0,https://www.reed.co.uk/jobs/network-infrastructure-engineer/52378748,52378748
183792,Axon Moore Group Ltd,,,P2P Process Lead,New Works,50000.0,55000.0,GBP,24/04/2024,26/03/2024,"P2P Process Lead | 50,000 - 55,000 | Remote Axon Moore are supporting a world-leading manufacturer that is looking for an Purchase to Pay (P2P) Process Excellence Lead. This is a remote role, you will have an integral role in driving change management and contribute to a continuous improvement culture across the organization. Key responsibilities: • Create strong business partnering with Global Supply Chain, Commercial Teams and the Business in ... ",0,https://www.reed.co.uk/jobs/p2p-process-lead/52378747,52378747
351628,MTrec Recruitment ,,,Distribution Administrator,Cramlington,27600.0,27600.0,GBP,08/05/2024,26/03/2024,"The Company Our client is a leading manufacturer in their sector. Due to growth, they are now looking to recruit a Distribution Administrator. The Role The successful person would be responsible for the co-ordination and control of their products to their global customer base, ensuring delivery performance meets cost, quality and service parameters and arrange and schedule the transport requirements for all departments both inbound and outbound,... ",0,https://www.reed.co.uk/jobs/distribution-administrator/52378746,52378746
274539,Heat Recruitment,,,Financial Planner,SG141JA,50000.0,60000.0,GBP,07/05/2024,16/01/2024,"A new opportunity has opened for an experienced Financial Planner to join a reputable company based in Hertford as they have too many clients between the four IFAs of the business. As a company they don't advertise, getting all their business through referrals and word of mouth. Some of the company clients who are looking for an adviser with a good understanding of investments, others are looking for holistic financial planning plus they have co... ",3,https://www.reed.co.uk/jobs/financial-planner/51961149,51961149
572151,HOORAY Recruitment,,,Removals Driver - Porter,Broadway,,,,08/05/2024,26/03/2024,"Are You an Experienced 7.5 Tonne Driver with practice in removals? Do you want to work for a company who are friendly, reliable, and committed to customer satisfaction? Ready to take the wheel? Yes? Great, get in touch today! Benefits of theRemovals Driver: Company pension Work related bonus scheme What are the day-to-day responsibilities of the Removals Driver: Providing removals services to customers and clients, at their homes, business premi... ",0,https://www.reed.co.uk/jobs/removals-driver-porter/52378745,52378745
274539,Heat Recruitment,,,Mortgage and Protection Administrator,RH121RD,23000.0,28000.0,GBP,07/05/2024,12/02/2024,"An exciting opportunity for a mortgage and protection administrator has opened at a highly regarded financial planning business, based in Horsham, that specialise in all aspects of savings, investments, and retirement planning. This is a fantastic opportunity to build on your industry knowledge by working with an established team of administrators who provide high-quality support to the firm’s financial advisers. The main purpose of this positio... ",7,https://www.reed.co.uk/jobs/mortgage-and-protection-administrator/52120690,52120690
274539,Heat Recruitment,,,Paraplanner,MK403JY,35000.0,45000.0,GBP,07/05/2024,12/02/2024,"There is a fantastic opportunity here for an experienced Paraplanner to join a well-established Financial Services Practice in the heart of Bedfordshire. The company we are assisting is a growing practice with a great industry name, focused on providing a highly personalised financial planning and investment management service with their clients at the heart of everything they do. You will have the opportunity to work in a supportive team enviro... ",3,https://www.reed.co.uk/jobs/paraplanner/52120370,52120370
553328,GCS Associates,,,CAD Designer / Graduate Designer / CAD Technician,AL100AN,25000.0,35000.0,GBP,08/05/2024,26/03/2024,"Role: CAD Designer / Graduate Designer / CAD Technician Sector: Construction / Building Materials / Steel Design Location: Hatfield Salary: 25,000 - 35,000 (Very dependant on Experience - Graduates will be considered) We are currently seeking a CAD Designer to join a leading construction materials supplies company. This independent company supplies a wide range of building materials all across the South East and they also have a Steels Departmen... ",0,https://www.reed.co.uk/jobs/cad-designer-graduate-designer-cad-technician/52378744,52378744
427940,Tradewind Recruitment,,,SENDCO,Doncaster,,,,08/05/2024,26/03/2024,"Are you passionate about making a positive impact on the lives of students with Special Educational Needs (SEN)? Do you thrive in a dynamic educational environment? Tradewind Recruitment have an exciting opportunity for you! Position: SENDCO (Special Educational Needs Coordinator) Location: Doncaster, South Yorkshire Start Date: ASAP Type: Full-Time About: Tradewind Recruitment is working with a school that is committed to providing an inclusive... ",0,https://www.reed.co.uk/jobs/sendco/52378743,52378743
351628,MTrec Recruitment ,,,Warehouse Operative,Newcastle Upon Tyne,11.5,11.5,GBP,08/05/2024,14/02/2024,"The Company: MTrec are currently recruiting for a renowned and respected manufacturing company based in the Gateshead area. MTrec are currently looking for proactive individuals who are looking for an ongoing position. The Role: Attending morning briefings with team leader / supervisors for daily production targets Carrying out visual quality checks of products, reporting defects to team leaders / supervisor Working in a fast paced distribution ... ",142,https://www.reed.co.uk/jobs/warehouse-operative/52130843,52130843
422508,Step Teachers Ltd,,,General Science Teacher,SW192JY,30000.0,49000.0,GBP,08/05/2024,26/03/2024,"Are you passionate about inspiring young minds and fostering a love for science? Do you thrive in a dynamic and supportive educational environment? If so, we want you to join our team at Step Teachers to work for an outstanding institution nestled in the heart of Wimbledon. Position: General Science Teacher &nbsp; Location: Wimbledon, London Contract Type: Full-time, Permanent Start Date: April 2024 Job Description: As a General Science Teacher,... ",1,https://www.reed.co.uk/jobs/general-science-teacher/52378742,52378742
316119,G2 Legal Limited,,,Commercial Property Solicitor,Reading,60000.0,75000.0,GBP,26/04/2024,26/03/2024,"Our client is one of the UK's leading full service law firms, with offices in Oxford, London and the South East region.&nbsp; They provide clients with practical and straightforward legal advice whatever their regional, national and international requirements. Their clients are commercial business, not-for-profit organisations, government agencies and private individuals. The firm is seeking a 3 years’ PQE Senior Commercial Property Solicitor sp... ",0,https://www.reed.co.uk/jobs/commercial-property-solicitor/52378741,52378741
575264,Reed,,,Childrens Senior Social Worker/ Advance Practitioner - Assessment and Intervention,OL11TT,40.0,40.0,GBP,27/04/2024,26/03/2024,"Our Client, Oldham&nbsp;Council, is seeking a Children’s Advanced Practitioner&nbsp;to join their Assessment and Intervention Team. This is a Hybrid Working Role! Fantastic payrate of 40&nbsp;per hour! Are you a Childrens Social Worker, passionate about making a difference in your community? Do not miss out on this fantastic opportunity! Responsibilities of this role: Support senior colleagues with the prioritisation, allocation, planning and re... ",0,https://www.reed.co.uk/jobs/childrens-senior-social-worker-advance-practitioner-assessment-and-intervention/52378740,52378740
633709,Hawkfield Recruitment.co.uk,,,Car Sales Executive ,CV344AP,21000.0,45000.0,GBP,08/05/2024,11/01/2024,"Hawkfield Recruitment is working with a Main Dealership that is looking to add a Car Sales Executive to their Dealership based in Leamington Spa. As a Car Sales Executive working for this Dealership, you will be responsible for maintaining its excellent reputation by delivering unrivaled customer service. You will be the face of the business, engaging with customers to fully understand their needs and assisting them through the entire process fr... ",4,https://www.reed.co.uk/jobs/car-sales-executive/51933106,51933106
351628,MTrec Recruitment ,,,Production Operative,Gateshead,15.04,15.04,GBP,08/05/2024,14/02/2024,Rewards and Benefits on Offer; Temp to Perm Opportunities available after a 6-month probation period Identified Manufacturing Career Path for progression including Industry lead training and development Leading Pay rates including higher overtime rates A well-regarded company culture Free on-site parking Excellent transportation links Recommend a Friend 50 gift voucher Christmas events and vouchers The Pay You’ll Receive; 15.04 per hour Overtime... ,164,https://www.reed.co.uk/jobs/production-operative/52130947,52130947
412516,Advanced Technical Recruitment,,,Product Development Manager,CB90AB,,,,26/04/2024,14/03/2024,"Now is an exciting time to join a growing provider of fiberoptic technologies at their Head Office in Suffolk. Due to continuing expansion we are now looking for a Product Development Manager to join their Senior Management Team. In this hands-on role, you will manage a multi-disciplinary engineering team delivering new and existing products to meet customer deadlines. This will see you involved in product development, project management, staff ... ",4,https://www.reed.co.uk/jobs/product-development-manager/52313006,52313006
436122,Salt Search,,,Solution Architect,London,600.0,800.0,GBP,30/04/2024,18/03/2024,"Solution Architect - 6 Month Contract - 600- 800/day - Outside IR35 - Hybrid Please note - this role requires a maximum 1 day a week in the London office, and their Developers are based in Madrid so a maximum of one trip of 3 days/2 nights in Madrid per month. I am currently supporting a key client looking for a Product Architect who will focus on creating an architectural strategy for the platform that delivers some of their flagship English te... ",63,https://www.reed.co.uk/jobs/solution-architect/52329895,52329895
575264,Reed,,,Special Needs Teaching Assistant,CR06BG,85.0,140.0,GBP,15/04/2024,14/03/2024,"Male Special Needs Teaching Assistants (South East London) Are you a compassionate and dedicated individual with a passion for supporting students with special educational needs? We are seeking Male Teaching Assistants to join our team in South East London. Whether you’re interested in long-term roles or day-to-day assignments, we have opportunities for you! Positions Available: Long-Term Teaching Assistant: Contract Type:&nbsp; Full-time, perma... ",1,https://www.reed.co.uk/jobs/special-needs-teaching-assistant/52313005,52313005
