employerId,employerName,employerProfileId,employerProfileName,jobTitle,locationName,minimumSalary,maximumSalary,currency,expirationDate,date,jobDescription,applications,jobUrl,id
607251,Xede Education,,,Challenging Behaviour Student Support Worker,Wolverhampton,15.0,15.0,GBP,03/04/2024,26/03/2024,"Job Title: Part-Time Support/Youth Worker for Students with EHCP's and SEMH Needs Location: Wolverhampton, West Midlands. Start Date: 8th April 2024. Interviews:&nbsp; Interviews are being held on Thursday afternoon, 28th March 2024. Salary: Paid hourly via PAYE, negotiable for the right candidate About Us: &nbsp;Our college is a leading Further Education (FE) institution dedicated to providing exceptional education and support to students with ... ",0,https://www.reed.co.uk/jobs/challenging-behaviour-student-support-worker/52378784,52378784
524744,Hays Specialist Recruitment Limited,,,Audit Manager,Carmarthen,45000.0,60000.0,GBP,08/05/2024,26/03/2024,"Your new company They are a distinctive and forward-thinking firm of Chartered Accountants. Their mission is to uphold the highest standards of expertise through their team of Qualified Chartered Accountants, Chartered Certified Accountants, and Chartered Tax Advisers. Established in Carmarthen over four decades ago, their client portfolio has expanded significantly, serving clients both locally and internationally. They have circa 30 staff and ... ",0,https://www.reed.co.uk/jobs/audit-manager/52378781,52378781
575264,Reed,,,Accountant Bookkeeper,TN163JP,28000.0,35000.0,GBP,27/04/2024,26/03/2024,"Accountant Bookkeeper Annual Salary: 28k - 33k (flexible up to 35k for the right candidate) Location: Biggin Hill Job Type: Full-time, Monday to Friday with flexible working hours We are seeking a diligent and experienced Accountant Bookkeeper to join our finance team. The ideal candidate will have a strong background in bookkeeping, with essential experience in Xero and VAT. Experience in management accounts and year-end processes would be a si... ",0,https://www.reed.co.uk/jobs/accountant-bookkeeper/52378782,52378782
549321,SNG Formerly Sovereign Housing Association,,,Finance Officer - Accounts Payable,RG214FA,26300.0,30000.0,GBP,10/04/2024,26/03/2024,"We have an opportunity for a Finance Officer to join our A ccounts Payable team in Basingstoke on a full time permanent basis. This is a hybrid role where you will be working at least two days in the office.&nbsp; The starting salary is 26,300 - 30,000 depending on experience The role&nbsp; As a Finance Officer in the Accounts Payable team you'll play a vital role in delivering payment services to our large stakeholder base. You'll be processing... ",0,https://www.reed.co.uk/jobs/finance-officer-accounts-payable/52378780,52378780
351628,MTrec Recruitment ,,,Assembly Line Operator ,NE95AY,11.44,11.44,GBP,08/05/2024,26/03/2024,"Rewards and Benefits on Offer; Temp to Perm Opportunities available after probation period A well-regarded company culture Free on-site parking Excellent transportation links The Pay You’ll Receive; 11.44 per hour The Hours You’ll Work; This position requires you to work 12-hour shifts, Monday - Thursday Dayshifts 6:00am - 18:00pm, Monday - Thursday (12-hour shifts) MTrec’s New Opportunity; MTrec Recruitment are currently recruiting for a presti... ",0,https://www.reed.co.uk/jobs/assembly-line-operator/52378779,52378779
357899,Now Careers,,,Accounts Assistant required,CF30LT,26000.0,27000.0,GBP,08/05/2024,26/03/2024,"I am recruiting on behalf of an SME family run business in the St Mellons area. My client is seeking a versatile and adaptable Accounts Assistant to join its very stable and friendly team. The role will report into the Group Accountant and will predominantly be dealing with the purchase ledger side of things. However, as this is a relatively small business the role will be varied on a daily basis. The client is able to pay up to 27,000 per annum... ",0,https://www.reed.co.uk/jobs/accounts-assistant-required/52378778,52378778
672811,	 Atrium Recruitment Limited,,,Construction Operations Manager,Tamworth,,,,08/05/2024,23/02/2024,"Construction Operations Manager Tamworth, Staffordshire Competitive Salary - To Be Discussed We are seeking an experienced&nbsp; Operations Manager &nbsp;with a construction / engineering background to join a well-established and successful engineering inspections company. You will play a critical role in ensuring the smooth and efficient execution of inspections whilst maintaining compliance with ISO 17020 and UKAS accreditation standards. Gene... ",7,https://www.reed.co.uk/jobs/construction-operations-manager/52186017,52186017
432060,Academics ,,,SEN Teaching Assistant,Rochester,75.0,95.0,GBP,08/05/2024,26/03/2024,"We are seeking a Teaching Assistant for young people aged 7-19 with Autism and associated needs. A specialist school based in a small village outside of Rochester are looking for a teaching assistant to work with pupils with MLD, ASD and complex needs, they have roles based inside the classroom as well as on their outreach program, supporting outdoor activites and visits to places such as the local stables. 08:30 - 16:30, Monday to Friday. The S... ",0,https://www.reed.co.uk/jobs/sen-teaching-assistant/52378777,52378777
464988,Page Group,,,Test Engineer,Cwmbran,,,,24/04/2024,26/03/2024,"We are seeking an industrious Test Engineer to join our client's Test &amp; Development department at their longstanding site in Cwmbran. Client Details Our client, Safran, is an esteemed player in the aerospace manufacturing industry, boasting a team of over 1000 employees. Specialising in the design, development and manufacturing of innovative solutions, they are a leader in their field and are based in Cwmbran. Description Conduct regular pro... ",0,https://www.reed.co.uk/jobs/test-engineer/52378776,52378776
351628,MTrec Recruitment ,,,Forklift Truck  Driver,Burnopfield,11.44,11.44,GBP,08/05/2024,26/03/2024,"The Company MTrec are currently recruiting for a specialist distribution firm based in the Newcastle area The Role Based at the end of the one of the machines labelling primarily Involved in packing, labelling and shrink wrapping pallets Manually batching and labelling packaging goods prior to dispatch Transporting products within the manufacturing area Operation of a counter balance forklift truck for transporting materials within the warehouse... ",0,https://www.reed.co.uk/jobs/forklift-truck-driver/52378775,52378775
575264,Reed,,,Long Term Science Teacher position - temporary,GU147NL,130.0,200.0,GBP,27/04/2024,26/03/2024,Are you a Science Teacher looking for long term work within Basingstoke? Interested in working within an Alternative Education Centre? Reed Education Southampton are currently seeking a passionate and dedicated Science Teacher to fulfil a long term cover role within an Alternative Education Centre located within Basingstoke. The school is a small Alternative Education Centre that caters to pupils where the curriculum is delivered within a flexib... ,0,https://www.reed.co.uk/jobs/long-term-science-teacher-position-temporary/52378774,52378774
575264,Reed,,,Long Term Science Teacher position - temporary,RG238AA,130.0,200.0,GBP,27/04/2024,26/03/2024,Are you a Science Teacher looking for long term work within Basingstoke? Interested in working within an Alternative Education Centre? Reed Education Southampton are currently seeking a passionate and dedicated Science Teacher to fulfil a long term cover role within an Alternative Education Centre located within Basingstoke. The school is a small Alternative Education Centre that caters to pupils where the curriculum is delivered within a flexib... ,0,https://www.reed.co.uk/jobs/long-term-science-teacher-position-temporary/52378771,52378771
575264,Reed,,,Long Term Science Teacher position - temporary,SO211AN,130.0,200.0,GBP,27/04/2024,26/03/2024,Are you a Science Teacher looking for long term work within Basingstoke? Interested in working within an Alternative Education Centre? Reed Education Southampton are currently seeking a passionate and dedicated Science Teacher to fulfil a long term cover role within an Alternative Education Centre located within Basingstoke. The school is a small Alternative Education Centre that caters to pupils where the curriculum is delivered within a flexib... ,0,https://www.reed.co.uk/jobs/long-term-science-teacher-position-temporary/52378772,52378772
575264,Reed,,,Long Term Science Teacher position - temporary,SP103HN,130.0,200.0,GBP,27/04/2024,26/03/2024,Are you a Science Teacher looking for long term work within Basingstoke? Interested in working within an Alternative Education Centre? Reed Education Southampton are currently seeking a passionate and dedicated Science Teacher to fulfil a long term cover role within an Alternative Education Centre located within Basingstoke. The school is a small Alternative Education Centre that caters to pupils where the curriculum is delivered within a flexib... ,0,https://www.reed.co.uk/jobs/long-term-science-teacher-position-temporary/52378773,52378773
652147,PLANET RECRUITMENT SERVICES LTD,,,2nd Line Support Engineer,Witney,25000.0,30000.0,GBP,08/05/2024,26/03/2024,"Role: 2nd Line Support Technician Location: Witney Salary: 25k - 30k Oxfordshire IT Company is looking for a dynamic ICT Support technician to join its team in the Witney, Oxfordshire area. Successful candidates will be exceptional communicators who excel at working within a team and also when working with end users. Successful candidates must undergo an enhanced DBS Check and ideally have a full UK driving license. In this role, you will work c... ",0,https://www.reed.co.uk/jobs/2nd-line-support-engineer/52378770,52378770
406145,The Purely Recruitment Company,,,Client Executive/Administrator - Fantastic entry level role ,CV346RG,24000.0,28000.0,GBP,08/05/2024,26/03/2024,"Who will I be working for? If you are looking to work in an exciting, start-up environment, then my client can offer you a warm, welcoming culture, where you will be a central member of the team. They are looking for someone with bags of enthusiasm, who loves all things administration and client services and who has a real drive to help the business grow and thrive. What will I be doing? Support the business with day-to-day administration duties... ",0,https://www.reed.co.uk/jobs/client-executive-administrator-fantastic-entry-level-role/52378768,52378768
588841,Workchain,,,Forklift Driver Reach,PE26YQ,12.0,13.0,GBP,24/04/2024,26/03/2024,Are you an experienced Forklift Driver with Reach experience looking for a permanent position in Peterborough? Workchain is currently recruiting for a Forklift Driver Reach to join a thriving industrial company in the area. Key responsibilities include: - Operating a forklift with excellent precision and care - Loading and unloading goods safely and efficiently - Organizing warehouse spaces and maintaining inventory records - Adhering to health ... ,0,https://www.reed.co.uk/jobs/forklift-driver-reach/52378769,52378769
675680,The Employment Network,,,Company Accountant,OX164SX,50000.0,60000.0,GBP,08/05/2024,26/03/2024,Your new company A successful family-owned business based in Banbury with a history of growth in the manufacturing industry is looking for a Company Accountant/Finance Manager with a background as number one in the finance department for a sub 25mil t/o company in the UK. You will work in a friendly environment in a leading role based in their office in Banbury full-time. Your new role Primary responsibility will be to run the financial and admi... ,0,https://www.reed.co.uk/jobs/company-accountant/52378767,52378767
575264,Reed,,,Caretaker,N11US,12.15,14.83,GBP,27/04/2024,26/03/2024,"Caretaker Mobile position&nbsp; Mobile Position Temp positions 3 months Temp with the option to extend PAYE: 12.15per hour PAYE or 14.83per hour Umbrella&nbsp; Location: EC1V&nbsp; Van and Fuel Card provide&nbsp; My client is a well-known housing association and they’re seeking experienced Estate Caretakers to clean and maintain internal, external and all common areas of housing blocks and estates. Hours 0800 - 1600 / Monday - Friday Key Respons... ",0,https://www.reed.co.uk/jobs/caretaker/52378766,52378766
340294,Off to Work,,,Event Porter,London,11.44,14.5,GBP,08/05/2024,26/03/2024,"Do you want to work behind the scenes at the coolest events? Are you hardworking, proactive and organised? Here at Off to Work we’ve got a backstage pass to work as event porters at the finest events in London. We’re talking international sporting fixtures, stadiums, restaurants, weddings and so much more! Whether you are a hospitality pro itching to get back or new to the field, we’d love to hear from you!&nbsp; Maybe you have&nbsp; warehouse &... ",0,https://www.reed.co.uk/jobs/event-porter/52378765,52378765
424608,Bennett & Game Recruitment,,,Senior Manager/Director Designate,Wilmslow,40000.0,50000.0,GBP,08/05/2024,26/03/2024,Senior Manager/Director Designate required. My client is seeking a dynamic and experienced individual to join the team as a Senior Manager/Director Designate. This is an exciting opportunity for someone ready to step into a leadership role in a well-established accountancy practice. The successful candidate will be able to demonstrate a track record in leadership skills and have the confidence to develop a high-performing team to grow the compan... ,0,https://www.reed.co.uk/jobs/senior-manager-director-designate/52378764,52378764
652147,PLANET RECRUITMENT SERVICES LTD,,,Senior IT Technician,Henley-on-Thames,33000.0,36000.0,GBP,02/05/2024,20/03/2024,"Role: Senior IT Technician Salary: 36k Location: Henley Benefits: Holidays: 22 days plus BH, increasing 1 day per full-service year, up to 25 days per annum plus BH Pension Life Assurance: 2 x Basic Salary Employee Benefits Platform: EAP, MyMindpal, Cycle-2-Work, High Street Rewards Staff Events Summary: The role is to manage the day-to-day operation of the ICT environment for the customer as part of a wider managed service team. The team's func... ",3,https://www.reed.co.uk/jobs/senior-it-technician/52349389,52349389
563988,Pontoon,,,Project Manager,Wokingham,550.0,600.0,GBP,10/04/2024,26/03/2024,"Job Title: Project Manager Duration: 6 months, extensions likely Location: Wokingham/Hybrid (once to twice per week requirement in the office) Salary: 550- 600 per day via Umbrella Pontoon is an employment consultancy. We put expertise, energy, and enthusiasm into improving everyone's chance of being part of the workplace. We respect and appreciate people of all ethnicities, generations, religious beliefs, sexual orientations, gender identities,... ",1,https://www.reed.co.uk/jobs/project-manager/52378763,52378763
339285,Lynx Recruitment Ltd,,,Ecommerce Business Analyst ,London,50000.0,65000.0,GBP,08/05/2024,26/03/2024,"Ecommerce Business Analyst | London| 50,000 - 60,000 (Dependent on experience) Lynx Recruitment are working with an exciting Ecommerce Agency that are recruiting an Ecommerce Business Analyst to join their team. This company offers hybrid working - 2 days per week onsite in Central London Key Skills: Proficient technical Business Analysis experience MUST HAVE E-commerce experience Magento OR Adobe Commerce OR Shopify OR BigCommerce knowledge Dig... ",1,https://www.reed.co.uk/jobs/ecommerce-business-analyst/52378762,52378762
272339,GerrardWhite,,,Residential Conveyancing Paralegal,Southampton,25000.0,32000.0,GBP,24/04/2024,26/03/2024,"Paralegal A highly regarded firm with a long-standing history is currently seeking a new paralegal to join their residential conveyancing team. This role will be based near Southampton, in the town of Chandler's Ford. The successful residential conveyancing paralegal will provide essential administrative support and assistance to fee-earners in the team. You will work closely with an experienced Associate, gaining hands-on experience with an int... ",0,https://www.reed.co.uk/jobs/residential-conveyancing-paralegal/52378760,52378760
351628,MTrec Recruitment ,,,production operative ,DH11TF,11.44,11.44,GBP,08/05/2024,26/03/2024,"The Company MTrec are currently recruiting for a rapidly expanding manufacturing company based in the Durham area. We are currently looking for candidates interested in working within a busy factory environment. The Role Carrying out general warehouse duties daily, including but not limited to Working in a fast paced warehouse environment Working in the heat transfer department Completing basic warehouse duties when required Using different comp... ",0,https://www.reed.co.uk/jobs/production-operative/52378761,52378761
364714,Prospero Teaching,,,PMLD Teacher,Romford,180.0,250.0,GBP,08/05/2024,26/03/2024,"SEND Teacher (PMLD) Secondary/Primary Romford Full Time Daily pay 180-250 depending on experience Are you a qualified Teacher looking for an opportunity to progress into the world of SEN? Our SEN Schools cater for students with a range of SEND types, however, this role is to support students on the Autism Spectrum, with a combination of verbal and nonverbal pupils and Complex Needs pupils. They provide diverse and inclusive learning environment ... ",0,https://www.reed.co.uk/jobs/pmld-teacher/52378759,52378759
628846,Osborn Executive Recruitment,,,Accounts Receivable and Billing Manager Location - London £65k - £70k,E140AD,65000.0,70000.0,GBP,08/05/2024,26/03/2024,"Accounts Receivable and Billing Manager Location - London 65k - 70k, Bonus, Non - contributory pension, Flex working - 4:1 The role: T he Accounts Receivable and Billing Manager role is critical for maintaining cash flow, minimising bad debts write offs, and ensuring timely payment collection. By implementing effective accounts receivable processes and fostering positive relationships with tenants, the role contributes to the financial health an... ",0,https://www.reed.co.uk/jobs/accounts-receivable-and-billing-manager-location-london-65k-70k/52378758,52378758
630334,Four Squared,,,Field Service Engineer ,Guildford,26000.0,32000.0,GBP,08/05/2024,26/03/2024,"Field Service Engineer Guilford, GU2 Full-time, Permanent Salary: 26,000 - 32,000 We are seeking a highly skilled and motivated Field Service Engineer to join our team. As a Field Service Engineer, you will be responsible for providing technical support and troubleshooting services to our customers. You will work closely with our customers to ensure the smooth operation of our products and provide exceptional customer service. Responsibilities -... ",0,https://www.reed.co.uk/jobs/field-service-engineer/52378757,52378757
543104,Jobheron ,,,Land Surveyor,Stoke-on-Trent,30000.0,40000.0,GBP,08/05/2024,26/03/2024,"An experienced Land Surveyor with at least 4 years of experience in setting out and surveying within the civil engineering industry is needed to join the team at this leading firm of land and engineering surveyors on a full-time basis. They are recruiting a land surveyor and setting out an engineer to work on different civil engineering projects across the UK. The position will carry a competitive salary for a site engineer, and the accompanying... ",0,https://www.reed.co.uk/jobs/land-surveyor/52378756,52378756
427013,Kingston Noble Career Consultancy,,,ANYCEM,Birmingham,37687.0,37687.0,GBP,08/05/2024,26/03/2024,"Location : Birmingham, UK Salary: 37,687 per annum, plus 1,680 car allowance Our client is seeking a vibrant and proactive individual to fill the role of Customer Engagement Manager. This pivotal position requires someone with a passion for fostering community engagement, collecting and analyzing feedback, and championing the needs of our residents and customers. If you're ready to take on new challenges in a dynamic organization, we want to hea... ",0,https://www.reed.co.uk/jobs/anycem/52378755,52378755
351628,MTrec Recruitment ,,,production operative ,Peterlee,11.44,11.44,GBP,08/05/2024,26/03/2024,"The Company MTrec Recruitment are currently recruiting for a prestigious company in the Peterlee area. The Role We are looking for candidates with production operative experience. The role would see you carrying out general production duties; including machine operating, quality inspection, and completing duties for despatch and inventory as designated by your supervisor. · Daily meetings with the team leader or supervisor · To help prioritise w... ",0,https://www.reed.co.uk/jobs/production-operative/52378754,52378754
671473,Rochdale Boroughwide Housing,,, Director of Business Improvement,OL162UP,90000.0,90000.0,GBP,08/05/2024,26/03/2024,"We own and manage around 13,000 homes within the Borough of Rochdale in Greater Manchester. We are the largest provider of affordable housing in the Borough and, in an economic environment where the supply of housing is at its most challenged, we take very seriously our responsibility for supporting the people who live in our homes and communities to live well and thrive. Our core purpose is to be a provider of quality homes and services to our ... ",0,https://www.reed.co.uk/jobs/director-of-business-improvement/52378753,52378753
106728,Next Employment,,,Binding Authority Technician ,EC3A1AT,50000.0,72000.0,GBP,08/05/2024,26/03/2024,I am currently looking for an experienced Technician in the US property sector but other classes will be considered. Ideally the Insurance Technician will have 4 years’ experience which includes North American Property Binding Authorities within a Lloyds Broker Experience of the Global system would be a distinct advantage however full training will be given to the successful candidate. Ideally looking for someone with a can do attitude and who i... ,0,https://www.reed.co.uk/jobs/binding-authority-technician/52378752,52378752
592050,Curo,,,Assistant Director of Strategy & Assurance ,BA21EP,67500.0,67500.0,GBP,15/04/2024,26/03/2024,"Assistant Director of Strategy &amp; Assurance 67,500 per annum Bath Permanent, Full Time What you'll be doing You will be leading on influencing positive changes at Curo by ensuring the quality and integrity of our operations and the delivery of our Strategic Plan. Working closely with the Executive Team, you will undertake risk-based monitoring activity across the Curo group and drive a culture of continuous improvement. It will be a fast-pace... ",0,https://www.reed.co.uk/jobs/assistant-director-of-strategy-assurance/52378751,52378751
272617,The Royal British Legion,,,Poppy Appeal Manager,Cornwall,28458.0,31620.0,GBP,08/05/2024,26/03/2024,"Are you looking to ensure the success of this unique initiative for the Royal British Legion as a Poppy Appeal Manager based in Cornwall? As the Poppy Appeal Manager in Cornwall, your main role is to achieve income, expenditure, and contribution targets, ensuring the success of the appeal. Collaborating with the Regional Poppy Appeal Manager, you will create and manage an income and expenditure budget, providing monthly commentary. Your responsi... ",0,https://www.reed.co.uk/jobs/poppy-appeal-manager/52378750,52378750
274539,Heat Recruitment,,,IFA Administrator,LU13LU,27000.0,30000.0,GBP,07/05/2024,14/11/2023,"We are assisting a Luton based company with an IFA administrator position. You will be working closely, one-on-one, with an IFA. The company has built some fantastic relationships with clients over the last 25 years so you will be a key part of further client relations. The position has become available due to an internal promotion and a new hire. There is a great community feel throughout the company, with a very friendly but professional worki... ",16,https://www.reed.co.uk/jobs/ifa-administrator/51622635,51622635
274539,Heat Recruitment,,,IFA Administrator ,GU97LW,24000.0,30000.0,GBP,07/05/2024,14/11/2023,We are assisting a client based in Farnham in hiring an IFA Administrator due to team growth. They are looking for someone ambitious and driven to join their reputable Financial Services Practice which provides a financial planning and investment management service. If you come on board you will learn directly from the financial planners and the investment team. You will get to work on complex cases over time and broaden your knowledge/ experien... ,6,https://www.reed.co.uk/jobs/ifa-administrator/51621353,51621353
274539,Heat Recruitment,,,Senior IFA Administrator,RG120AB,30000.0,36000.0,GBP,07/05/2024,14/11/2023,"We are assisting a Bracknell based company with a Senior IFA administrator position. You will be working closely, one one-on-one, with an IFA, this adviser has been with the company for 7 years and has built some fantastic relationships with clients over the years. The position has become available due to an internal promotion so you will benefit from a handover and still be able to get help/ guidance from this colleague. There is a great commun... ",6,https://www.reed.co.uk/jobs/senior-ifa-administrator/51621186,51621186
274539,Heat Recruitment,,,Administrator,GU342YT,18000.0,22000.0,GBP,07/05/2024,07/12/2023,"We are working with a highly reputable wealth management firm in Alton who are looking for someone to join their support team as an Office Admin / Junior Admin They are open to receiving applications from school leavers, graduates and those with an element of administration experience. You will be supported heavily in your career development and allowed to grow from within the firm (this role has become available due to internal promotions, whic... ",8,https://www.reed.co.uk/jobs/administrator/51759895,51759895
